{
  "$schema": "../../../../../../scripts/specs/schema/styled.schema.json",
  "kind": "styled",
  "entry": "@scnx/system/components/navbar",
  "entryKind": "presentational",
  "stability": "candidate",
  "primitive": null,
  "anatomy": [
    {
      "name": "root",
      "selector": ".scnx-navbar"
    },
    {
      "name": "start",
      "selector": ".scnx-navbar__start"
    },
    {
      "name": "center",
      "selector": ".scnx-navbar__center"
    },
    {
      "name": "end",
      "selector": ".scnx-navbar__end"
    }
  ],
  "options": {},
  "states": [],
  "fixture": {
    "tree": {
      "type": "Navbar",
      "children": [
        {
          "type": "Navbar.Start",
          "children": [
            "Brand"
          ]
        },
        {
          "type": "Navbar.Center",
          "children": [
            "Search"
          ]
        },
        {
          "type": "Navbar.End",
          "children": [
            "Account"
          ]
        }
      ]
    }
  },
  "bindings": [
    {
      "part": "root",
      "declarations": {
        "background-color": "{color.neutral.surface.default.default}",
        "border-bottom": "{dimension.border-width.default} solid {color.neutral.border.subtle.default}"
      }
    },
    {
      "part": "start",
      "declarations": {
        "gap": "{dimension.spacing.inline-comfortable}",
        "padding": "0 {dimension.spacing.page}"
      }
    },
    {
      "part": "center",
      "declarations": {
        "gap": "{dimension.spacing.inline-comfortable}",
        "padding": "0 {dimension.spacing.page}"
      }
    },
    {
      "part": "end",
      "declarations": {
        "gap": "{dimension.spacing.inline-comfortable}",
        "padding": "0 {dimension.spacing.page}"
      }
    }
  ],
  "hookScope": "Set a hook on a scope the product owns, not on :root, so a runtime change restyles that scope only, for example .promo { --scnx-navbar-background: …; }.",
  "hooks": [
    {
      "hook": "--scnx-navbar-background",
      "parts": [
        "root"
      ],
      "properties": [
        "background-color"
      ],
      "fallbacks": [
        "{color.neutral.surface.default.default}"
      ],
      "floor": null,
      "purpose": "The background-color of Navbar.",
      "coverage": "scnx-platform and scnx-saas, light and dark.",
      "migration": "Added in @scnx/system 2.0.0-beta.0, before v1; additive, no consumer change."
    },
    {
      "hook": "--scnx-navbar-border-color",
      "parts": [
        "root"
      ],
      "properties": [
        "border-bottom"
      ],
      "fallbacks": [
        "{color.neutral.border.subtle.default}"
      ],
      "floor": null,
      "purpose": "The border-bottom of Navbar.",
      "coverage": "scnx-platform and scnx-saas, light and dark.",
      "migration": "Added in @scnx/system 2.0.0-beta.0, before v1; additive, no consumer change."
    },
    {
      "hook": "--scnx-navbar-border-width",
      "parts": [
        "root"
      ],
      "properties": [
        "border-bottom"
      ],
      "fallbacks": [
        "{dimension.border-width.default}"
      ],
      "floor": null,
      "purpose": "The border-bottom of Navbar.",
      "coverage": "scnx-platform and scnx-saas, light and dark.",
      "migration": "Added in @scnx/system 2.0.0-beta.0, before v1; additive, no consumer change."
    },
    {
      "hook": "--scnx-navbar-height",
      "parts": [
        "root"
      ],
      "properties": [
        "height",
        "max-height"
      ],
      "fallbacks": [
        "4rem"
      ],
      "floor": null,
      "purpose": "The height and max-height of Navbar.",
      "coverage": "scnx-platform and scnx-saas, light and dark.",
      "migration": "Added in @scnx/system 2.0.0-beta.0, before v1; additive, no consumer change."
    },
    {
      "hook": "--scnx-navbar-section-gap",
      "parts": [
        "center",
        "end",
        "start"
      ],
      "properties": [
        "gap"
      ],
      "fallbacks": [
        "{dimension.spacing.inline-comfortable}"
      ],
      "floor": null,
      "purpose": "The gap of Navbar's center, end and start part.",
      "coverage": "scnx-platform and scnx-saas, light and dark.",
      "migration": "Added in @scnx/system 2.0.0-beta.0, before v1; additive, no consumer change."
    },
    {
      "hook": "--scnx-navbar-section-padding-inline",
      "parts": [
        "center",
        "end",
        "start"
      ],
      "properties": [
        "padding"
      ],
      "fallbacks": [
        "{dimension.spacing.page}"
      ],
      "floor": null,
      "purpose": "The padding of Navbar's center, end and start part.",
      "coverage": "scnx-platform and scnx-saas, light and dark.",
      "migration": "Added in @scnx/system 2.0.0-beta.0, before v1; additive, no consumer change."
    },
    {
      "hook": "--scnx-navbar-start-width",
      "parts": [
        "start"
      ],
      "properties": [
        "width"
      ],
      "fallbacks": [
        "17.5rem"
      ],
      "floor": null,
      "purpose": "The width of Navbar's start part.",
      "coverage": "scnx-platform and scnx-saas, light and dark.",
      "migration": "Added in @scnx/system 2.0.0-beta.0, before v1; additive, no consumer change."
    }
  ]
}
